,res,start,end
in the quantity supplied,59,1950,2008
in the regression analysis,59,1950,2008
in the sample that,59,1950,2008
in the second trimester,59,1950,2008
in the simulation of,59,1950,2008
in the transformation process,59,1950,2008
in the usa as,59,1950,2008
in the valence band,59,1950,2008
in their commitment to,59,1950,2008
in their perceptions of,59,1950,2008
in theory and research,59,1950,2008
in this model are,59,1950,2008
in uttar pradesh and,59,1950,2008
in west germany in,59,1950,2008
incidence of side effects,59,1950,2008
incorporated into the analysis,59,1950,2008
incorporation of amino acids,59,1950,2008
increase in the levels,59,1950,2008
indian council of medical,59,1950,2008
indian institute of technology,59,1950,2008
inflows and outflows of,59,1950,2008
information about the topic,59,1950,2008
information can be transmitted,59,1950,2008
information from the environment,59,1950,2008
information that can help,59,1950,2008
instead of focusing on,59,1950,2008
institute for nuclear research,59,1950,2008
institute of geology and,59,1950,2008
insurance companies and pension,59,1950,2008
interactions with other people,59,1950,2008
interest in the potential,59,1950,2008
international monetary fund staff,59,1950,2008
interpersonal theory of psychiatry,59,1950,2008
interval estimate of the,59,1950,2008
interval for the mean,59,1950,2008
into question the very,59,1950,2008
into the environment and,59,1950,2008
into the trash can,59,1950,2008
introduction in this paper,59,1950,2008
introduction to probability theory,59,1950,2008
involved in a wide,59,1950,2008
involvement in the political,59,1950,2008
involvement in the process,59,1950,2008
is a better predictor,59,1950,2008
is a challenging task,59,1950,2008
is a high priority,59,1950,2008
is a major challenge,59,1950,2008
is a major contributor,59,1950,2008
is a major goal,59,1950,2008
is a potent inhibitor,59,1950,2008
is a powerful technique,59,1950,2008
is a resource that,59,1950,2008
is a signatory to,59,1950,2008
is a top priority,59,1950,2008
is a weighted sum,59,1950,2008
is aimed at providing,59,1950,2008
is also the issue,59,1950,2008
is anticipated to be,59,1950,2008
is argued here that,59,1950,2008
is crucial for a,59,1950,2008
is crucial that the,59,1950,2008
is currently under investigation,59,1950,2008
is difficult to quantify,59,1950,2008
is essential reading for,59,1950,2008
is forbidden without the,59,1950,2008
is from this perspective,59,1950,2008
is implemented in a,59,1950,2008
is important if you,59,1950,2008
is interesting here is,59,1950,2008
is less than ideal,59,1950,2008
is mainly related to,59,1950,2008
is mirrored by the,59,1950,2008
is no consensus as,59,1950,2008
is no firm evidence,59,1950,2008
is not an option,59,1950,2008
is particularly relevant for,59,1950,2008
is so special about,59,1950,2008
is still seen as,59,1950,2008
is striking about the,59,1950,2008
is the exchange rate,59,1950,2008
is the transfer function,59,1950,2008
is under consideration of,59,1950,2008
is used to assess,59,1950,2008
is used to monitor,59,1950,2008
is useful to look,59,1950,2008
isolated from the mainstream,59,1950,2008
issues need to be,59,1950,2008
issues of common concern,59,1950,2008
issues of the journal,59,1950,2008
it 's about to,59,1950,2008
it 's actually a,59,1950,2008
it 's not necessarily,59,1950,2008
it all together and,59,1950,2008
it also noted that,59,1950,2008
it can also cause,59,1950,2008
it has been implemented,59,1950,2008
it in the trunk,59,1950,2008
it made more sense,59,1950,2008
it only makes sense,59,1950,2008
it provides a framework,59,1950,2008
it was inappropriate to,59,1950,2008
it was widely assumed,59,1950,2008
items you want to,59,1950,2008
ithiel de sola pool,59,1950,2008
its current level of,59,1950,2008
its ease of use,59,1950,2008
its most basic form,59,1950,2008
japan and west germany,59,1950,2008
japanese with english summary,59,1950,2008
jesus ' death on,59,1950,2008
journal of clinical nutrition,59,1950,2008
journal of ecclesiastical history,59,1950,2008
journal of legal education,59,1950,2008
journal of the japanese,59,1950,2008
julius and ethel rosenberg,59,1950,2008
just about any other,59,1950,2008
just about anything that,59,1950,2008
key concept in the,59,1950,2008
key role in this,59,1950,2008
know about the topic,59,1950,2008
know from the hon,52,1950,2001
knows that he or,59,1950,2008
korean people 's army,59,1950,2008
korean war broke out,59,1950,2008
kuwait and saudi arabia,59,1950,2008
lackland air force base,59,1950,2008
large pot of water,59,1950,2008
leaned over and gave,59,1950,2008
learned over the years,59,1950,2008
learning a second language,59,1950,2008
least for the foreseeable,59,1950,2008
led to speculation that,59,1950,2008
led to the demise,59,1950,2008
legal status of any,59,1950,2008
lesions in patients with,59,1950,2008
less committed to the,59,1950,2008
less likely to participate,59,1950,2008
less likely to vote,59,1950,2008
let me be clear,59,1950,2008
level of awareness of,59,1950,2008
levels are associated with,59,1950,2008
levels of carbon dioxide,59,1950,2008
levels of social and,59,1950,2008
like i have to,59,1950,2008
like it was yesterday,59,1950,2008
like there was no,59,1950,2008
linked to a specific,59,1950,2008
local bookstore or use,56,1950,2005
longevity of the council,59,1950,2008
look at how they,59,1950,2008
look very similar to,59,1950,2008
looked like he might,59,1950,2008
looked like they 'd,59,1950,2008
looking at what is,59,1950,2008
los angeles international airport,59,1950,2008
lt is estimated that,59,1950,2008
made on a case,59,1950,2008
magazine of fantasy and,59,1950,2008
magnitude higher than the,59,1950,2008
major areas of concern,59,1950,2008
majority of the sample,59,1950,2008
make a big deal,59,1950,2008
make a decision based,59,1950,2008
make an educated guess,59,1950,2008
make the most sense,59,1950,2008
many of those involved,59,1950,2008
marginal cost of capital,59,1950,2008
marginal tax rate of,59,1950,2008
mark next to the,59,1950,2008
market power of the,59,1950,2008
mass media in the,59,1950,2008
materials or for the,59,1950,2008
max planck institute for,59,1950,2008
maximize the chances of,59,1950,2008
maximize the use of,59,1950,2008
may also choose to,59,1950,2008
may be compounded by,59,1950,2008
may need to add,59,1950,2008
may want to think,59,1950,2008
mean of the sampling,59,1950,2008
means without written permission,59,1950,2008
mechanism to ensure that,59,1950,2008
meet his or her,59,1950,2008
meeting of the midwest,59,1950,2008
meets the guidelines for,59,1950,2008
met the criteria for,59,1950,2008
method of family planning,59,1950,2008
military assistance advisory group,59,1950,2008
million by the year,59,1950,2008
million in fiscal year,59,1950,2008
minister be pleased to,59,1950,2008
ministry of housing and,59,1950,2008
ministry of local government,59,1950,2008
ministry of natural resources,59,1950,2008
minnesota studies in the,59,1950,2008
model has also been,59,1950,2008
model is presented in,59,1950,2008
model is used for,59,1950,2008
model used for the,59,1950,2008
models is that the,59,1950,2008
modern sector of the,59,1950,2008
monetary fund staff papers,59,1950,2008
money in the account,59,1950,2008
more important determinant of,59,1950,2008
more likely to focus,59,1950,2008
more positive attitudes toward,59,1950,2008
most likely to experience,59,1950,2008
most of her adult,59,1950,2008
much more sophisticated and,59,1950,2008
multiple copies of a,59,1950,2008
muscle in her body,59,1950,2008
must have a unique,59,1950,2008
muttered under her breath,59,1950,2008
my dad and i,59,1950,2008
myriad ways in which,59,1950,2008
name you want to,59,1950,2008
national archives and records,59,1950,2008
national commission on the,59,1950,2008
national iranian oil company,59,1950,2008
national library of canada,59,1950,2008
nations children ' s,59,1950,2008
nature of his or,59,1950,2008
nature of women 's,59,1950,2008
near east and south,59,1950,2008
near eastern texts relating,59,1950,2008
need access to the,59,1950,2008
need to adapt to,59,1950,2008
need to be successful,59,1950,2008
need to be there,59,1950,2008
need to change to,59,1950,2008
need to compute the,59,1950,2008
need to decide how,59,1950,2008
need to define a,59,1950,2008
need to move on,59,1950,2008
need to reach out,59,1950,2008
need to resolve the,59,1950,2008
need to select a,59,1950,2008
need to take on,59,1950,2008
need to talk with,59,1950,2008
needs and concerns of,59,1950,2008
negative evaluation of the,59,1950,2008
negative feelings about the,59,1950,2008
negatively associated with the,59,1950,2008
net earnings from self,59,1950,2008
never in a million,59,1950,2008
new york and tokyo,59,1950,2008
new york review of,59,1950,2008
news of jesus christ,59,1950,2008
nicaragua and el salvador,59,1950,2008
normalization of relations between,59,1950,2008
normalized with respect to,59,1950,2008
normally distributed random variable,59,1950,2008
not a replacement for,59,1950,2008
not all that important,59,1950,2008
not clear how to,59,1950,2008
not differ between the,59,1950,2008
not figured out how,59,1950,2008
not from around here,59,1950,2008
not give a shit,59,1950,2008
not have a duty,59,1950,2008
not just that we,59,1950,2008
not pose a problem,59,1950,2008
not reject the null,59,1950,2008
not significantly different at,59,1950,2008
not violate the first,59,1950,2008
noted in this context,59,1950,2008
now you 're ready,59,1950,2008
nuclear weapons and foreign,59,1950,2008
null hypothesis when it,59,1950,2008
number of parameters to,59,1950,2008
number of physicians per,59,1950,2008
objective of this research,59,1950,2008
oct nov dec jan,59,1950,2008
of ' other ',59,1950,2008
of a digital computer,59,1950,2008
of a gene that,59,1950,2008
of a kind used,59,1950,2008
of a larger set,59,1950,2008
of a law enforcement,59,1950,2008
of a mix of,59,1950,2008
of actin and myosin,59,1950,2008
of adrenaline and noradrenaline,59,1950,2008
of african and asian,59,1950,2008
of an asset 's,59,1950,2008
of an immune response,59,1950,2008
of an integrated approach,59,1950,2008
of an operating system,59,1950,2008
of biochemistry and biophysics,59,1950,2008
of carcinoma in situ,59,1950,2008
of children and families,59,1950,2008
of children with severe,59,1950,2008
of citizenship and immigration,59,1950,2008
of civilian persons in,59,1950,2008
of colonialism and imperialism,59,1950,2008
of communist and workers,59,1950,2008
of community mental health,59,1950,2008
of concern that the,59,1950,2008
of congruence between the,59,1950,2008
of cycles to failure,59,1950,2008
of different cell types,59,1950,2008
of dna and rna,59,1950,2008
of dna in the,59,1950,2008
of fantasy and science,59,1950,2008
of finance be pleased,51,1950,2000
of foreign exchange earnings,59,1950,2008
of growth hormone and,59,1950,2008
of herpes simplex virus,59,1950,2008
of home affairs be,52,1950,2001
of housing and local,59,1950,2008
of hunters and gatherers,59,1950,2008
of india dated the,59,1950,2008
of its commitment to,59,1950,2008
of its potential for,59,1950,2008
of labor and delivery,59,1950,2008
of law and public,59,1950,2008
of lung cancer and,59,1950,2008
of mao ' s,59,1950,2008
of monetary policy on,59,1950,2008
of philosophy of education,59,1950,2008
of political participation and,59,1950,2008
of procedure and conduct,59,1950,2008
of rapid economic growth,59,1950,2008
of risk associated with,59,1950,2008
of science fiction and,59,1950,2008
of south korea 's,59,1950,2008
of state dean rusk,59,1950,2008
of studies suggest that,59,1950,2008
of the administrative state,59,1950,2008
of the african states,59,1950,2008
of the air pollution,59,1950,2008
of the american left,59,1950,2008
of the autocorrelation function,59,1950,2008
of the central military,59,1950,2008
of the computer and,59,1950,2008
of the construct of,59,1950,2008
of the consumer price,59,1950,2008
of the correlation function,59,1950,2008
of the covariance matrix,59,1950,2008
of the cuban economy,59,1950,2008
of the decision maker,59,1950,2008
of the decision process,59,1950,2008
of the decisionmaking process,59,1950,2008
of the developing country,59,1950,2008
of the dow jones,59,1950,2008
of the eisenhower administration,59,1950,2008
of the electronics industry,59,1950,2008
of the endogenous variables,59,1950,2008
of the exogenous variables,59,1950,2008
of the explanatory variables,59,1950,2008
of the freedom struggle,59,1950,2008
of the governing council,59,1950,2008
of the high authority,59,1950,2008
of the insolvency act,59,1950,2008
of the international style,59,1950,2008
of the international symposium,59,1950,2008
of the intervention and,59,1950,2008
of the key components,59,1950,2008
of the labor process,59,1950,2008
of the labour code,59,1950,2008
of the labour court,59,1950,2008
of the liberation movements,59,1950,2008
of the likelihood ratio,59,1950,2008
of the local elite,59,1950,2008
of the lok sabha,59,1950,2008
of the majority culture,59,1950,2008
of the manufacturing sector,59,1950,2008
of the measurement process,59,1950,2008
of the molecular ion,59,1950,2008
of the more exotic,59,1950,2008
of the most frustrating,59,1950,2008
of the muslim brotherhood,59,1950,2008
of the nail plate,59,1950,2008
of the overall economy,59,1950,2008
of the pentagon 's,59,1950,2008
of the political debate,59,1950,2008
of the random walk,59,1950,2008
of the review process,59,1950,2008
of the revolutionary council,59,1950,2008
of the rich countries,59,1950,2008
of the rotator cuff,59,1950,2008
of the science fiction,59,1950,2008
of the side effects,59,1950,2008
of the speech community,59,1950,2008
of the stock price,59,1950,2008
of the strain rate,59,1950,2008
of the stress field,59,1950,2008
of the target 's,59,1950,2008
of the transition matrix,59,1950,2008
of the treatment effect,59,1950,2008
of the ussr council,59,1950,2008
of the ussr supreme,59,1950,2008
of the uttar pradesh,59,1950,2008
of the valence band,59,1950,2008
of the wave vector,59,1950,2008
of the writing process,59,1950,2008
of the zona pellucida,59,1950,2008
of these side effects,59,1950,2008
of this model of,59,1950,2008
of this time period,59,1950,2008
of transference and countertransference,59,1950,2008
of trust and respect,59,1950,2008
of uttar pradesh and,59,1950,2008
of west germany and,59,1950,2008
of will to power,59,1950,2008
oil in a frying,59,1950,2008
oil prices in the,59,1950,2008
on a cruise ship,59,1950,2008
on a magnetic tape,59,1950,2008
on a strategy of,59,1950,2008
on a tight budget,59,1950,2008
on a tv screen,59,1950,2008
on access to the,59,1950,2008
on an occasional basis,59,1950,2008
on issues related to,59,1950,2008
on more than just,59,1950,2008
on production guidelines for,59,1950,2008
on the chalkboard or,59,1950,2008
on the freedom to,59,1950,2008
on the goals and,59,1950,2008
on the human condition,59,1950,2008
on the lunar surface,59,1950,2008
on the main diagonal,59,1950,2008
on the passenger side,59,1950,2008
on the peaceful uses,59,1950,2008
on the sample size,59,1950,2008
on the spot market,59,1950,2008
on the task force,59,1950,2008
on this in chapter,59,1950,2008
on women and the,59,1950,2008
one 's own cultural,59,1950,2008
one hell of an,59,1950,2008
one of two values,59,1950,2008
one to two orders,59,1950,2008
one way to begin,59,1950,2008
only if he or,59,1950,2008
opportunity cost of producing,59,1950,2008
opportunity cost of the,59,1950,2008
opportunity to interact with,59,1950,2008
or her point of,59,1950,2008
or if you need,59,1950,2008
or introduced into a,59,1950,2008
or she has done,59,1950,2008
orders of magnitude more,59,1950,2008
organized crime in the,59,1950,2008
other family members in,59,1950,2008
other forms of oppression,59,1950,2008
other studies have found,59,1950,2008
other techniques such as,59,1950,2008
others in ways that,59,1950,2008
over a low heat,59,1950,2008
over the next half,59,1950,2008
over time as the,59,1950,2008
overall charge of the,59,1950,2008
overview of some of,59,1950,2008
overview of the various,59,1950,2008
oxygen delivery to the,59,1950,2008
pace of change in,59,1950,2008
papers laid on the,57,1950,2006
particular concern is the,59,1950,2008
passenger side of the,59,1950,2008
patient 's perception of,59,1950,2008
penguin books india pvt,59,1950,2008
people 's democratic party,59,1950,2008
people in hong kong,59,1950,2008
people of color in,59,1950,2008
per capita availability of,59,1950,2008
per capita income levels,59,1950,2008
perceive and respond to,59,1950,2008
perceives to be the,59,1950,2008
percent of the residents,59,1950,2008
perception of the role,59,1950,2008
permanence and durability of,59,1950,2008
permits the user to,59,1950,2008
personal and professional lives,59,1950,2008
personality and ability testing,59,1950,2008
persons in time of,59,1950,2008
phone off the hook,59,1950,2008
picture that emerges is,59,1950,2008
pierre teilhard de chardin,59,1950,2008
plan for your life,59,1950,2008
plant and equipment investment,59,1950,2008
plasma membrane and the,59,1950,2008
play it by ear,59,1950,2008
playing by the rules,59,1950,2008
please write to penguin,58,1950,2007
pleased to state the,57,1950,2006
point in time that,59,1950,2008
polish people 's republic,59,1950,2008
political process in the,59,1950,2008
pollution of the sea,59,1950,2008
portion of the electromagnetic,59,1950,2008
posed a serious threat,59,1950,2008
posed no threat to,59,1950,2008
poses a challenge to,59,1950,2008
poses a serious threat,59,1950,2008
position on an issue,59,1950,2008
positive association between the,59,1950,2008
positive attitudes toward the,59,1950,2008
potential benefits of the,59,1950,2008
power of positive thinking,59,1950,2008
pradesh and west bengal,59,1950,2008
presence of high levels,59,1950,2008
president ho chi minh,59,1950,2008
presidium of the ussr,59,1950,2008
pressures to conform to,59,1950,2008
price elasticity of supply,59,1950,2008
prices and numbers are,56,1950,2005
primary focus is on,59,1950,2008
principles of internal medicine,59,1950,2008
prior to initiation of,59,1950,2008
private sector and the,59,1950,2008
probability theory and its,59,1950,2008
problem is not with,59,1950,2008
problem is that no,59,1950,2008
problem with this type,59,1950,2008
procedure and conduct of,59,1950,2008
proceedings of the symposium,59,1950,2008
process that begins with,59,1950,2008
processes in the system,59,1950,2008
processes that contribute to,59,1950,2008
production and inventory control,59,1950,2008
production guidelines for book,59,1950,2008
project to develop a,59,1950,2008
projects in the area,59,1950,2008
protection of civilian persons,59,1950,2008
provide a conceptual framework,59,1950,2008
provide a level of,59,1950,2008
public goods and services,59,1950,2008
public health service publication,59,1950,2008
published in gazette of,59,1950,2008
puerto rico ' s,59,1950,2008
put food on the,59,1950,2008
quality of the decision,59,1950,2008
question the relevance of,59,1950,2008
random sample of size,59,1950,2008
randomly selected from a,59,1950,2008
rate of degradation of,59,1950,2008
rates of economic growth,59,1950,2008
reading and writing skills,59,1950,2008
reality is that it,59,1950,2008
realized she did not,59,1950,2008
reasonable to hypothesize that,59,1950,2008
recognised the need to,59,1950,2008
reduced by up to,59,1950,2008
refer to the reply,58,1950,2007
reflect the values of,59,1950,2008
reflects the number of,59,1950,2008
regional and local level,59,1950,2008
reiter ' s syndrome,59,1950,2008
relating to the old,59,1950,2008
relationship with the person,59,1950,2008
relationships with family members,59,1950,2008
relative to all other,59,1950,2008
reliability of the system,59,1950,2008
report and review of,59,1950,2008
republic of china 's,59,1950,2008
requiem for a nun,59,1950,2008
research in the teaching,59,1950,2008
researchers have found that,59,1950,2008
resolution of this issue,59,1950,2008
resolved the problem of,59,1950,2008
responding to the survey,59,1950,2008
response to the events,59,1950,2008
responsive to their needs,59,1950,2008
rest frame of the,59,1950,2008
review of international affairs,59,1950,2008
revised and expanded version,59,1950,2008
right of private defence,59,1950,2008
right to choose to,59,1950,2008
rise of the west,59,1950,2008
risk to the public,59,1950,2008
role and place of,59,1950,2008
role as wife and,59,1950,2008
role in the emergence,59,1950,2008
role of communication in,59,1950,2008
rome air development center,59,1950,2008
run average cost curve,59,1950,2008
s assessment of the,59,1950,2008
said as he reached,59,1950,2008
said with a small,59,1950,2008
said with a smirk,59,1950,2008
sample size is large,59,1950,2008
satisfied with their lives,59,1950,2008
says more about the,59,1950,2008
schedule of the constitution,59,1950,2008
scheduled castes and tribes,59,1950,2008
scottish journal of theology,59,1950,2008
search for meaning and,59,1950,2008
second set of questions,59,1950,2008
secretary of defense robert,59,1950,2008
secretion of antidiuretic hormone,59,1950,2008
see the previous section,59,1950,2008
seem like such a,59,1950,2008
seen as a function,59,1950,2008
seen as a possible,59,1950,2008
seen as an act,59,1950,2008
seen as an important,59,1950,2008
seen as the best,59,1950,2008
sense of common identity,59,1950,2008
sense of trust in,59,1950,2008
serious problem with the,59,1950,2008
set of criteria that,59,1950,2008
set of variables that,59,1950,2008
several recent studies have,59,1950,2008
shall focus on the,59,1950,2008
share an interest in,59,1950,2008
share at least one,59,1950,2008
share of the top,59,1950,2008
share the same values,59,1950,2008
share with the class,59,1950,2008
she 'd been working,59,1950,2008
she 'd ever had,59,1950,2008
she 'd seen the,59,1950,2008
she 'd told me,59,1950,2008
she argues that the,59,1950,2008
she notes that the,59,1950,2008
shook his head no,59,1950,2008
should also ensure that,59,1950,2008
should be structured to,59,1950,2008
shown in the box,59,1950,2008
shows a schematic of,59,1950,2008
signed into law on,59,1950,2008
significant amount of time,59,1950,2008
significant impact upon the,59,1950,2008
significant improvement over the,59,1950,2008
significant in the context,59,1950,2008
significantly more effective than,59,1950,2008
simply not the case,59,1950,2008
site of the enzyme,59,1950,2008
size of the file,59,1950,2008
sleeping through the night,59,1950,2008
social class differences in,59,1950,2008
social context within which,59,1950,2008
social issues such as,59,1950,2008
social norms and values,59,1950,2008
sociology of georg simmel,59,1950,2008
solution to the system,59,1950,2008
some of the challenges,59,1950,2008
something you 're not,59,1950,2008
south asia and the,59,1950,2008
south korea and japan,59,1950,2008
southern illinois university press,59,1950,2008
southern methodist university press,59,1950,2008
soviet union and east,59,1950,2008
spearman 's rank correlation,59,1950,2008
spectra were recorded on,59,1950,2008
spectral density of the,59,1950,2008
spend time with their,59,1950,2008
squeezed his eyes shut,59,1950,2008
staatliche museen zu berlin,59,1950,2008
stages i and ii,59,1950,2008
stages of economic growth,59,1950,2008
stark contrast between the,59,1950,2008
state of madhya pradesh,59,1950,2008
state of the environment,59,1950,2008
state of uttar pradesh,59,1950,2008
state power and the,59,1950,2008
states and other industrialized,59,1950,2008
states department of defense,59,1950,2008
states involved in the,59,1950,2008
states of the council,59,1950,2008
steps government have taken,43,1950,1992
still seen as a,59,1950,2008
stockholm school of economics,59,1950,2008
stood to the side,59,1950,2008
strict limits on the,59,1950,2008
strong dependence on the,59,1950,2008
strong links with the,59,1950,2008
structural transformation of the,59,1950,2008
structured according to the,59,1950,2008
studies have established that,59,1950,2008
studies have shown an,59,1950,2008
studies of the impact,59,1950,2008
studies suggest that there,59,1950,2008
study of the changing,59,1950,2008
study suggested that the,59,1950,2008
such as family and,59,1950,2008
sufficient in form and,59,1950,2008
suppression of communism act,59,1950,2008
sure as hell did,59,1950,2008
sure as hell was,59,1950,2008
sure to check with,59,1950,2008
survival of patients with,59,1950,2008
system need to be,59,1950,2008
system to ensure that,59,1950,2008
table a copy of,52,1950,2001
takes a closer look,59,1950,2008
talk about what 's,59,1950,2008
talk to the person,59,1950,2008
tax credit for the,59,1950,2008
television coverage of the,59,1950,2008
tell the students that,59,1950,2008
tens to hundreds of,59,1950,2008
term stability of the,59,1950,2008
term that describes the,59,1950,2008
terms of their potential,59,1950,2008
test of the model,59,1950,2008
texas christian university press,59,1950,2008
text are to this,59,1950,2008
that affect the way,59,1950,2008
that allow you to,59,1950,2008
that are driven by,59,1950,2008
that are grounded in,59,1950,2008
that are most relevant,59,1950,2008
that can arise when,59,1950,2008
that can assist in,59,1950,2008
that can cause the,59,1950,2008
that complies with the,59,1950,2008
that emerged out of,59,1950,2008
that enable people to,59,1950,2008
that from the perspective,59,1950,2008
that have implications for,59,1950,2008
that interact with the,59,1950,2008
that moment in time,59,1950,2008
that requires them to,59,1950,2008
that runs on the,59,1950,2008
that shed light on,59,1950,2008
that the bill to,51,1950,2000
that the demand under,44,1950,1993
that the file is,59,1950,2008
that the new technology,59,1950,2008
that the novel 's,59,1950,2008
that the problem lies,59,1950,2008
that the prosecutor 's,59,1950,2008
that was about it,59,1950,2008
that was central to,59,1950,2008
that would eventually become,59,1950,2008
that you work with,59,1950,2008
the acquisition of literacy,59,1950,2008
the active sites of,59,1950,2008
