,res,start,end
a better alternative to,59,1950,2008
a better predictor of,59,1950,2008
a black leather jacket,59,1950,2008
a broader context of,59,1950,2008
a car accident and,59,1950,2008
a carton of milk,59,1950,2008
a confidence level of,59,1950,2008
a consensus that the,59,1950,2008
a current account deficit,59,1950,2008
a direct confrontation with,59,1950,2008
a division of penguin,59,1950,2008
a duty to ensure,59,1950,2008
a dynamic model of,59,1950,2008
a dynamic process that,59,1950,2008
a family member who,59,1950,2008
a feel for what,59,1950,2008
a few phone calls,59,1950,2008
a founding father of,59,1950,2008
a function of exposure,59,1950,2008
a fundamental right to,59,1950,2008
a greater impact than,59,1950,2008
a handful of countries,59,1950,2008
a history of technology,59,1950,2008
a key concept in,59,1950,2008
a lack of support,59,1950,2008
a legal framework for,59,1950,2008
a linear sequence of,59,1950,2008
a long hard look,59,1950,2008
a loss of information,59,1950,2008
a low dose of,59,1950,2008
a major improvement in,59,1950,2008
a massive amount of,59,1950,2008
a more personal level,59,1950,2008
a more realistic model,59,1950,2008
a motion to compel,59,1950,2008
a motion to suppress,59,1950,2008
a need to look,59,1950,2008
a negative association between,59,1950,2008
a number of asian,59,1950,2008
a number of potentially,59,1950,2008
a period of sustained,59,1950,2008
a positive association between,59,1950,2008
a power struggle between,59,1950,2008
a powerful tool to,59,1950,2008
a prior history of,59,1950,2008
a priority of the,59,1950,2008
a public limited company,59,1950,2008
a range of choices,59,1950,2008
a range of skills,59,1950,2008
a reduced ability to,59,1950,2008
a regular basis by,59,1950,2008
a search warrant for,59,1950,2008
a sense of involvement,59,1950,2008
a sequence of independent,59,1950,2008
a significant risk of,59,1950,2008
a solid understanding of,59,1950,2008
a specific geographic area,59,1950,2008
a state of disarray,59,1950,2008
a step change in,59,1950,2008
a strategy designed to,59,1950,2008
a system that uses,59,1950,2008
a tape recorder to,59,1950,2008
a taylor series expansion,59,1950,2008
a textbook example of,59,1950,2008
a total ban on,59,1950,2008
a variety of communication,59,1950,2008
a variety of scales,59,1950,2008
a very limited role,59,1950,2008
a wider spectrum of,59,1950,2008
a woman 's reproductive,59,1950,2008
a working group to,59,1950,2008
ability to interact with,59,1950,2008
about how they can,59,1950,2008
about how to approach,59,1950,2008
about one order of,59,1950,2008
about the credibility of,59,1950,2008
about the environment and,59,1950,2008
about the interaction between,59,1950,2008
about their feelings and,59,1950,2008
about their relationship with,59,1950,2008
accept the legitimacy of,59,1950,2008
according to this logic,59,1950,2008
across the plasma membrane,59,1950,2008
acute renal failure and,59,1950,2008
affairs be pleased to,52,1950,2001
african institute of social,59,1950,2008
after the korean war,59,1950,2008
against the benefits of,59,1950,2008
agreed to be interviewed,59,1950,2008
agricultural stabilization and conservation,59,1950,2008
ahead of the competition,59,1950,2008
alert the reader to,59,1950,2008
all sectors of society,59,1950,2008
all with private bath,59,1950,2008
allow you to have,59,1950,2008
allows the system to,59,1950,2008
along with a check,59,1950,2008
although the impact of,59,1950,2008
always be there for,59,1950,2008
amend the code of,59,1950,2008
amendment privilege against self,59,1950,2008
american psychiatric association 's,59,1950,2008
americans during world war,59,1950,2008
amino acid sequence in,59,1950,2008
an alternative approach would,59,1950,2008
an analysis of covariance,59,1950,2008
an appropriate model for,59,1950,2008
an assessment of what,59,1950,2008
an empirical investigation of,59,1950,2008
an essential precondition for,59,1950,2008
an introduction to probability,59,1950,2008
an organizational structure that,59,1950,2008
an overall evaluation of,59,1950,2008
an overall impression of,59,1950,2008
and a wide array,59,1950,2008
and are marked on,59,1950,2008
and central to the,59,1950,2008
and child health care,59,1950,2008
and conduct of business,59,1950,2008
and department of defense,59,1950,2008
and economic policy in,59,1950,2008
and effective implementation of,59,1950,2008
and expertise of the,59,1950,2008
and flipped it open,59,1950,2008
and for the foreseeable,59,1950,2008
and further take notice,50,1950,1999
and how they 're,59,1950,2008
and how to respond,59,1950,2008
and in the media,59,1950,2008
and is a key,59,1950,2008
and issues related to,59,1950,2008
and medicine in the,59,1950,2008
and motioned for the,59,1950,2008
and numbers are subject,57,1950,2006
and other industrialized countries,59,1950,2008
and other mental health,59,1950,2008
and other professionals who,59,1950,2008
and other socialist countries,59,1950,2008
and outputs of the,59,1950,2008
and parkinson 's disease,59,1950,2008
and quantification of the,59,1950,2008
and realized she was,59,1950,2008
and references cited therein,59,1950,2008
and reflect on their,59,1950,2008
and reprinted with permission,59,1950,2008
and scientific and technological,59,1950,2008
and social context of,59,1950,2008
and take corrective action,59,1950,2008
and techniques used to,59,1950,2008
and the challenges of,59,1950,2008
and the costs associated,59,1950,2008
and the current account,59,1950,2008
and the european community,59,1950,2008
and the host country,59,1950,2008
and the ocean floor,59,1950,2008
and the opportunity cost,59,1950,2008
and the perception that,59,1950,2008
and the private sectors,59,1950,2008
and their involvement in,59,1950,2008
and time course of,59,1950,2008
and trinidad and tobago,59,1950,2008
and type ii errors,59,1950,2008
and within the context,59,1950,2008
and y are independent,59,1950,2008
announced the judgment of,59,1950,2008
another way as well,59,1950,2008
antibodies directed against the,59,1950,2008
approach is to have,59,1950,2008
approach is used for,59,1950,2008
archives and records service,59,1950,2008
archives of the vatican,59,1950,2008
archivio di stato di,59,1950,2008
are an alternative to,59,1950,2008
are currently being developed,59,1950,2008
are currently working on,59,1950,2008
are highly likely to,59,1950,2008
are not relevant for,59,1950,2008
are often portrayed as,59,1950,2008
are played out in,59,1950,2008
are positively associated with,59,1950,2008
are seen as being,59,1950,2008
are set to zero,59,1950,2008
are the single most,59,1950,2008
area chamber of commerce,59,1950,2008
area where you can,59,1950,2008
arms race and the,59,1950,2008
around the time the,59,1950,2008
around the world have,59,1950,2008
as a baseline for,59,1950,2008
as a metaphor of,59,1950,2008
as a rationale for,59,1950,2008
as a strategy for,59,1950,2008
as agents of change,59,1950,2008
as an important issue,59,1950,2008
as hell did not,59,1950,2008
as inputs to the,59,1950,2008
as inserted by section,59,1950,2008
as opposed to just,59,1950,2008
as someone who could,59,1950,2008
as the primary focus,59,1950,2008
asian and middle eastern,59,1950,2008
asked on the floor,59,1950,2008
aspect of my life,59,1950,2008
aspects of the text,59,1950,2008
assessment of the risk,59,1950,2008
associated with the implementation,59,1950,2008
assumptions of the model,59,1950,2008
at a remote location,59,1950,2008
at a seminar on,59,1950,2008
at edwards air force,59,1950,2008
at harvard business school,59,1950,2008
at sites such as,59,1950,2008
at some point i,59,1950,2008
at the bachelor 's,59,1950,2008
at the coffee shop,59,1950,2008
at the corporate level,59,1950,2008
at the country level,59,1950,2008
at the defense table,59,1950,2008
at the fermi level,59,1950,2008
at the jet propulsion,59,1950,2008
at the max planck,59,1950,2008
at the most general,59,1950,2008
at the trial level,59,1950,2008
auditor general of india,59,1950,2008
author 's interview with,59,1950,2008
away from the viewer,59,1950,2008
back to haunt me,59,1950,2008
bacterial and viral infections,59,1950,2008
balance of payments problems,59,1950,2008
balance the demands of,59,1950,2008
banca nazionale del lavoro,59,1950,2008
banco nacional de cuba,59,1950,2008
baptism in the holy,59,1950,2008
based on this approach,59,1950,2008
be a better predictor,59,1950,2008
be a long night,59,1950,2008
be a significant problem,59,1950,2008
be associated with lower,59,1950,2008
be conceptualized as a,59,1950,2008
be crucial for the,59,1950,2008
be deployed in the,59,1950,2008
be different depending on,59,1950,2008
be evaluated in light,59,1950,2008
be fully integrated into,59,1950,2008
be helpful to use,59,1950,2008
be implemented on a,59,1950,2008
be in his late,59,1950,2008
be made about how,59,1950,2008
be monitored by the,59,1950,2008
be perceived as having,59,1950,2008
be performed using a,59,1950,2008
be positioned at the,59,1950,2008
be read or written,59,1950,2008
be reunited with her,59,1950,2008
be seen as both,59,1950,2008
be seen in isolation,59,1950,2008
be seen to represent,59,1950,2008
be spending a lot,59,1950,2008
be strongly dependent on,59,1950,2008
became the first african,59,1950,2008
become the de facto,59,1950,2008
been the single most,59,1950,2008
been used to analyze,59,1950,2008
before and after independence,59,1950,2008
beg to lay on,51,1950,2000
beliefs and values that,59,1950,2008
believes in me will,59,1950,2008
benefit in terms of,59,1950,2008
between economic growth and,59,1950,2008
between north korea and,59,1950,2008
between self and other,59,1950,2008
between the federal republic,59,1950,2008
between the matrix and,59,1950,2008
between the private sector,59,1950,2008
bihar and uttar pradesh,59,1950,2008
blow the whistle on,59,1950,2008
boil in a large,59,1950,2008
book is organized into,59,1950,2008
book longevity of the,59,1950,2008
book meets the guidelines,59,1950,2008
books available from penguin,58,1950,2007
bookstore or use this,58,1950,2007
both dna and rna,59,1950,2008
bottom right of the,59,1950,2008
brain stem reticular formation,59,1950,2008
breakdown of the marriage,59,1950,2008
bring down the government,59,1950,2008
broad base of support,59,1950,2008
broader social and political,59,1950,2008
but not below zero,59,1950,2008
butter in a large,59,1950,2008
by asking students to,59,1950,2008
by government in this,52,1950,2001
by one percentage point,59,1950,2008
by people such as,59,1950,2008
by the cold war,59,1950,2008
by the defense department,59,1950,2008
by the international organization,59,1950,2008
by the lok sabha,59,1950,2008
by the sample size,59,1950,2008
california department of fish,59,1950,2008
can be a key,59,1950,2008
can be anywhere from,59,1950,2008
can be costly and,59,1950,2008
can be derived using,59,1950,2008
can be obtained via,59,1950,2008
can be programmed to,59,1950,2008
can be quite expensive,59,1950,2008
can be solved using,59,1950,2008
can determine if the,59,1950,2008
can end up with,59,1950,2008
can lead to significant,59,1950,2008
can make an informed,59,1950,2008
can not hurt to,59,1950,2008
can occur in patients,59,1950,2008
can provide useful information,59,1950,2008
can set up your,59,1950,2008
can you conclude about,59,1950,2008
capabilities of the system,59,1950,2008
capability of the system,59,1950,2008
capital gains tax rate,59,1950,2008
capitalist relations of production,59,1950,2008
captures some of the,59,1950,2008
carcinoma in situ of,59,1950,2008
care needs of the,59,1950,2008
care of the elderly,59,1950,2008
carried out to assess,59,1950,2008
cash basis of accounting,59,1950,2008
catcher in the rye,59,1950,2008
center for research on,59,1950,2008
center of international studies,59,1950,2008
central states speech journal,59,1950,2008
chairman mao ' s,59,1950,2008
challenge the status quo,59,1950,2008
challenges of the future,59,1950,2008
change the way we,59,1950,2008
changing role of women,59,1950,2008
charges which will come,27,1950,1976
check mark next to,59,1950,2008
check to see what,59,1950,2008
chief justice earl warren,59,1950,2008
chief of military history,59,1950,2008
children 's learning and,59,1950,2008
choose not to do,59,1950,2008
choose the best answer,59,1950,2008
civil rights acts of,59,1950,2008
civilian persons in time,59,1950,2008
clear differences in the,59,1950,2008
clearly linked to the,59,1950,2008
closer look at some,59,1950,2008
code can be used,59,1950,2008
college of american pathologists,59,1950,2008
come in many different,59,1950,2008
come under attack from,59,1950,2008
come up with anything,59,1950,2008
come up with is,59,1950,2008
come you 're not,59,1950,2008
coming up with new,59,1950,2008
commission on law enforcement,59,1950,2008
commitment to the group,59,1950,2008
committed to each other,59,1950,2008
committee on production guidelines,59,1950,2008
common in the elderly,59,1950,2008
community mental health services,59,1950,2008
companies and pension funds,59,1950,2008
compensatory and punitive damages,59,1950,2008
component of a larger,59,1950,2008
computer can be used,59,1950,2008
conceptions of the self,59,1950,2008
conceptual model of the,59,1950,2008
conclusions in this chapter,59,1950,2008
conduction and valence bands,59,1950,2008
conference on the peaceful,59,1950,2008
confidence interval for a,59,1950,2008
congress of the cpsu,59,1950,2008
considered the issue of,59,1950,2008
constraints imposed on the,59,1950,2008
contains the address of,59,1950,2008
contents of the accumulator,59,1950,2008
contents of the file,59,1950,2008
context of a more,59,1950,2008
control back to the,59,1950,2008
control of air pollution,59,1950,2008
control the money supply,59,1950,2008
copyright owner and the,59,1950,2008
correlation function of the,59,1950,2008
costs and benefits are,59,1950,2008
could be a problem,59,1950,2008
could be implemented in,59,1950,2008
could be very important,59,1950,2008
could not relate to,59,1950,2008
council of medical research,59,1950,2008
countries in the south,59,1950,2008
countries of the former,59,1950,2008
countries of the socialist,59,1950,2008
country 's economic growth,59,1950,2008
covariance matrix of the,59,1950,2008
create a system that,59,1950,2008
created a whole new,59,1950,2008
crisis of the mid,59,1950,2008
criteria for assessing the,59,1950,2008
cultural and historical context,59,1950,2008
currently available on the,59,1950,2008
dab in the middle,59,1950,2008
data as it is,59,1950,2008
day 's journey into,59,1950,2008
de novo synthesis of,59,1950,2008
dead sea scrolls and,59,1950,2008
decision making by the,59,1950,2008
defined as part of,59,1950,2008
degree of overlap between,59,1950,2008
demand for medical care,59,1950,2008
demands placed on them,59,1950,2008
demographic characteristics of the,59,1950,2008
demographic composition of the,59,1950,2008
department of anatomy and,59,1950,2008
department of health services,59,1950,2008
describes a set of,59,1950,2008
describes each of the,59,1950,2008
desperately wanted to be,59,1950,2008
develop a model of,59,1950,2008
develop a relationship with,59,1950,2008
developed in our laboratory,59,1950,2008
development and economic growth,59,1950,2008
development of the model,59,1950,2008
did not pose a,59,1950,2008
did not share a,59,1950,2008
did play a role,59,1950,2008
differ significantly between the,59,1950,2008
difference in people 's,59,1950,2008
differences between the way,59,1950,2008
different ways you can,59,1950,2008
difficult it can be,59,1950,2008
difficult to pinpoint the,59,1950,2008
distributed with a mean,59,1950,2008
distribution of this book,59,1950,2008
distribution with degrees of,59,1950,2008
division of penguin books,59,1950,2008
do not match up,59,1950,2008
do not perform well,59,1950,2008
do not settle for,59,1950,2008
do you see yourself,59,1950,2008
documents related to the,59,1950,2008
does this relate to,59,1950,2008
down the hallway toward,59,1950,2008
durability of the committee,59,1950,2008
during the british rule,59,1950,2008
during the plan period,59,1950,2008
during the postpartum period,59,1950,2008
dynamic behaviour of the,59,1950,2008
dynamic model of the,59,1950,2008
each contracting party shall,59,1950,2008
each other 's strengths,59,1950,2008
ease of use and,59,1950,2008
eastern texts relating to,59,1950,2008
economic viability of the,59,1950,2008
education of children with,59,1950,2008
edwards air force base,59,1950,2008
effects of air pollution,59,1950,2008
effects of monetary policy,59,1950,2008
effects of television on,59,1950,2008
efficient use of energy,59,1950,2008
eigenvalues and eigenvectors of,59,1950,2008
either effective or ineffective,59,1950,2008
el colegio de méxico,59,1950,2008
elements of the vector,59,1950,2008
emerged as a significant,59,1950,2008
employee 's gross income,59,1950,2008
end of the korean,59,1950,2008
end of the planning,59,1950,2008
ends up on the,59,1950,2008
engaged in sexual intercourse,59,1950,2008
england penguin books australia,59,1950,2008
enjoy the challenge of,59,1950,2008
ensuring the survival of,59,1950,2008
entry and exit points,59,1950,2008
equilibrium level of income,59,1950,2008
essays in the philosophy,59,1950,2008
estimate the impact of,59,1950,2008
estimate the parameters of,59,1950,2008
estimates of the coefficients,59,1950,2008
estimates of the impact,59,1950,2008
estimation of the parameters,59,1950,2008
ethnic groups and the,59,1950,2008
ethnic groups such as,59,1950,2008
etudes et de recherches,59,1950,2008
evaluated in light of,59,1950,2008
evaluated the effectiveness of,59,1950,2008
evaluated to determine whether,59,1950,2008
evaluating the impact of,59,1950,2008
evaluation and selection of,59,1950,2008
evaluation of the impact,59,1950,2008
examined the extent to,59,1950,2008
examined the use of,59,1950,2008
examines the history of,59,1950,2008
excess demand for money,59,1950,2008
excess supply of money,59,1950,2008
exchange rate at the,59,1950,2008
exercise of first amendment,59,1950,2008
expand the definition of,59,1950,2008
expanding the role of,59,1950,2008
experienced some form of,59,1950,2008
experienced the death of,59,1950,2008
exploration and use of,59,1950,2008
explorations in entrepreneurial history,59,1950,2008
explore ways in which,59,1950,2008
explored in this chapter,59,1950,2008
explores the nature of,59,1950,2008
extend to three years,59,1950,2008
extend to two years,59,1950,2008
facial expressions of emotion,59,1950,2008
fall and rise of,59,1950,2008
fall of the soviet,59,1950,2008
family members should be,59,1950,2008
fantasy and science fiction,59,1950,2008
fbi law enforcement bulletin,59,1950,2008
featured on the cover,59,1950,2008
federal income taxation of,59,1950,2008
feel like you 've,59,1950,2008
feel safe enough to,59,1950,2008
feminist point of view,59,1950,2008
fifth amendment privilege against,59,1950,2008
fifth circuit held that,59,1950,2008
finance be pleased to,51,1950,2000
financial assets and liabilities,59,1950,2008
firm conclusions about the,59,1950,2008
five year plan period,59,1950,2008
focus on the present,59,1950,2008
focus on the role,59,1950,2008
focused almost exclusively on,59,1950,2008
focused largely on the,59,1950,2008
following shall be substituted,59,1950,2008
for a given project,59,1950,2008
for a more sophisticated,59,1950,2008
for assessing the quality,59,1950,2008
for book longevity of,59,1950,2008
for emotionally disturbed children,59,1950,2008
for further information contact,59,1950,2008
for his helpful comments,59,1950,2008
for input and output,59,1950,2008
for nuclear power plants,59,1950,2008
for permanence and durability,59,1950,2008
for personality and ability,59,1950,2008
for squamous cell carcinoma,59,1950,2008
for successful implementation of,59,1950,2008
for the exchange rate,59,1950,2008
for the less developed,59,1950,2008
for this research was,59,1950,2008
for training and research,59,1950,2008
for use in patients,59,1950,2008
for what seems like,59,1950,2008
for workers ' compensation,59,1950,2008
foreign exchange earnings from,59,1950,2008
format and content of,59,1950,2008
found that women who,59,1950,2008
framework from which to,59,1950,2008
free university of berlin,59,1950,2008
from a christian perspective,59,1950,2008
from a commitment to,59,1950,2008
from a different culture,59,1950,2008
from a perspective that,59,1950,2008
from a remote location,59,1950,2008
from a uniform distribution,59,1950,2008
from coronary heart disease,59,1950,2008
from high levels of,59,1950,2008
from the korean war,59,1950,2008
from this perspective that,59,1950,2008
front of the tv,59,1950,2008
further take notice that,50,1950,1999
genes have been identified,59,1950,2008
get along just fine,59,1950,2008
get off the plane,59,1950,2008
give me a hug,59,1950,2008
global balance of power,59,1950,2008
go on a date,59,1950,2008
goal here is to,59,1950,2008
goals of the system,59,1950,2008
god 's word says,59,1950,2008
going back in time,59,1950,2008
good faith belief that,59,1950,2008
good man is hard,59,1950,2008
good overview of the,59,1950,2008
goodness of fit test,59,1950,2008
gospel according to luke,59,1950,2008
got the distinct impression,59,1950,2008
government of uttar pradesh,59,1950,2008
government to ensure that,59,1950,2008
greater or equal to,59,1950,2008
gripped the steering wheel,59,1950,2008
ground rules for the,59,1950,2008
guarantee of equal protection,59,1950,2008
guess what i 'm,59,1950,2008
guide you through the,59,1950,2008
guidelines for book longevity,59,1950,2008
guidelines for permanence and,59,1950,2008
had a powerful impact,59,1950,2008
had been central to,59,1950,2008
had ground to a,59,1950,2008
had made it through,59,1950,2008
had no problem in,59,1950,2008
had the capability of,59,1950,2008
had the potential to,59,1950,2008
hang out at the,59,1950,2008
has a direct impact,59,1950,2008
has a great impact,59,1950,2008
has a greater impact,59,1950,2008
has been addressed in,59,1950,2008
has great potential for,59,1950,2008
have a major impact,59,1950,2008
have argued elsewhere that,59,1950,2008
have been concerned that,59,1950,2008
have been implemented to,59,1950,2008
have been studied using,59,1950,2008
have called into question,59,1950,2008
have examined the relationship,59,1950,2008
have had little impact,59,1950,2008
have the goal of,59,1950,2008
having a bad day,59,1950,2008
having a child with,59,1950,2008
he checked his watch,59,1950,2008
he or she begins,59,1950,2008
he watched as she,59,1950,2008
he worried about the,59,1950,2008
headquartered in new york,59,1950,2008
health and mental health,59,1950,2008
heat flux at the,59,1950,2008
help them deal with,59,1950,2008
help us understand why,59,1950,2008
help you identify the,59,1950,2008
her head in disbelief,59,1950,2008
her majesty in right,59,1950,2008
hereon may be reproduced,59,1950,2008
hero with a thousand,59,1950,2008
high high high high,59,1950,2008
high level of generality,59,1950,2008
highly likely to be,59,1950,2008
him to focus on,59,1950,2008
his or her back,59,1950,2008
his or her care,59,1950,2008
home affairs be pleased,52,1950,2001
homes for the elderly,59,1950,2008
homogeneous in terms of,59,1950,2008
housing and local government,59,1950,2008
how come you never,59,1950,2008
how decisions are made,59,1950,2008
how did you decide,59,1950,2008
how difficult it can,59,1950,2008
how does this relate,59,1950,2008
hugh of st victor,59,1950,2008
i 'm more concerned,59,1950,2008
i 'm still working,59,1950,2008
i called my mother,59,1950,2008
i can attest to,59,1950,2008
i get the picture,59,1950,2008
i need time to,59,1950,2008
i needed to talk,59,1950,2008
i was involved with,59,1950,2008
i was pregnant with,59,1950,2008
i will need to,59,1950,2008
i wish to focus,59,1950,2008
if the computer is,59,1950,2008
if you 're traveling,59,1950,2008
if your children are,59,1950,2008
image of the united,59,1950,2008
impact on the entire,59,1950,2008
impact on the organization,59,1950,2008
implementation of the proposed,59,1950,2008
implications for the way,59,1950,2008
in a middle school,59,1950,2008
in a plastic container,59,1950,2008
in a plural society,59,1950,2008
in a second step,59,1950,2008
in a significant reduction,59,1950,2008
in acute renal failure,59,1950,2008
in anticipation of litigation,59,1950,2008
in confrontation with the,59,1950,2008
in critically ill patients,59,1950,2008
in decision making in,59,1950,2008
in earnings per share,59,1950,2008
in health and illness,59,1950,2008
in his support for,59,1950,2008
in ho chi minh,59,1950,2008
in its assessment of,59,1950,2008
in jeans and a,59,1950,2008
in just about any,59,1950,2008
in madhya pradesh and,59,1950,2008
in overall charge of,59,1950,2008
in patients with idiopathic,59,1950,2008
in patients with large,59,1950,2008
in sediments of the,59,1950,2008
in social theory and,59,1950,2008
in society and history,59,1950,2008
in squamous cell carcinoma,59,1950,2008
in stark contrast with,59,1950,2008
in terms of support,59,1950,2008
in the archive of,59,1950,2008
in the arms race,59,1950,2008
in the assessment process,59,1950,2008
in the basement membrane,59,1950,2008
in the broader context,59,1950,2008
in the cultural context,59,1950,2008
in the current version,59,1950,2008
in the decision process,59,1950,2008
in the dna of,59,1950,2008
in the eastern caribbean,59,1950,2008
in the fashion industry,59,1950,2008
in the freezer for,59,1950,2008
in the high season,59,1950,2008
in the horn of,59,1950,2008
in the human rights,59,1950,2008
in the ignition and,59,1950,2008
in the indian society,59,1950,2008
in the industrialised countries,59,1950,2008
in the initial conditions,59,1950,2008
in the irish republic,59,1950,2008
in the lateral decubitus,59,1950,2008
in the media is,59,1950,2008
in the membrane potential,59,1950,2008
in the model in,59,1950,2008
in the money stock,59,1950,2008
in the native american,59,1950,2008
in the overall development,59,1950,2008
in the overall scheme,59,1950,2008
in the present climate,59,1950,2008
