,res,start,end
the air pollution control,59,1950,2008
the ambience of the,59,1950,2008
the american sociological association,59,1950,2008
the amount of dna,59,1950,2008
the appropriate standard of,59,1950,2008
the art of scientific,59,1950,2008
the asian and pacific,59,1950,2008
the assumptions behind the,59,1950,2008
the autocorrelation function of,59,1950,2008
the benefits of using,59,1950,2008
the best predictors of,59,1950,2008
the big picture of,59,1950,2008
the brain stem reticular,59,1950,2008
the british high commission,59,1950,2008
the burden of persuasion,59,1950,2008
the caribbean and south,59,1950,2008
the cartesian product of,59,1950,2008
the case of iraq,59,1950,2008
the catcher in the,59,1950,2008
the challenge of creating,59,1950,2008
the challenge of finding,59,1950,2008
the charges which will,31,1950,1980
the claim that god,59,1950,2008
the client 's current,59,1950,2008
the code for a,59,1950,2008
the cognitive aspects of,59,1950,2008
the coin is that,59,1950,2008
the computer can be,59,1950,2008
the computer to perform,59,1950,2008
the conceptual basis of,59,1950,2008
the concerns of those,59,1950,2008
the confidence interval is,59,1950,2008
the context of cultural,59,1950,2008
the context of real,59,1950,2008
the context of religious,59,1950,2008
the copyright owner and,59,1950,2008
the core values of,59,1950,2008
the cost and complexity,59,1950,2008
the council on library,59,1950,2008
the council on social,59,1950,2008
the covariance between the,59,1950,2008
the covariance matrix of,59,1950,2008
the cultural context of,59,1950,2008
the culture at large,59,1950,2008
the current account balance,59,1950,2008
the current account deficit,59,1950,2008
the current population survey,59,1950,2008
the decision makers in,59,1950,2008
the decision making process,59,1950,2008
the decision to become,59,1950,2008
the demographic characteristics of,59,1950,2008
the design phase of,59,1950,2008
the developed countries and,59,1950,2008
the developed countries in,59,1950,2008
the developed countries of,59,1950,2008
the development of literacy,59,1950,2008
the development process is,59,1950,2008
the dialectical relationship between,59,1950,2008
the dirac delta function,59,1950,2008
the directive principles of,59,1950,2008
the discipline of history,59,1950,2008
the discipline of psychology,59,1950,2008
the discipline of sociology,59,1950,2008
the disenchantment of the,59,1950,2008
the division of christian,59,1950,2008
the dna in the,59,1950,2008
the dominant view of,59,1950,2008
the ecological balance of,59,1950,2008
the economist intelligence unit,59,1950,2008
the effects of television,59,1950,2008
the eigenvalues and eigenvectors,59,1950,2008
the electoral process and,59,1950,2008
the electric field gradient,59,1950,2008
the end of colonialism,59,1950,2008
the equilibrium exchange rate,59,1950,2008
the evaluation of patients,59,1950,2008
the existing power structure,59,1950,2008
the family planning association,59,1950,2008
the federal aviation agency,59,1950,2008
the federal ministry for,59,1950,2008
the female labour force,59,1950,2008
the field of developmental,59,1950,2008
the fifth amendment privilege,59,1950,2008
the file on the,59,1950,2008
the focus of study,59,1950,2008
the following be added,59,1950,2008
the following described land,59,1950,2008
the formal institutions of,59,1950,2008
the freedom movement in,59,1950,2008
the general certificate of,59,1950,2008
the genetic material of,59,1950,2008
the global balance of,59,1950,2008
the goals of treatment,59,1950,2008
the government 's inability,59,1950,2008
the government 's response,59,1950,2008
the group areas act,59,1950,2008
the guidelines for permanence,59,1950,2008
the hell is she,59,1950,2008
the hero with a,59,1950,2008
the history of jazz,59,1950,2008
the house of saud,59,1950,2008
the human relations area,59,1950,2008
the immediate wake of,59,1950,2008
the impulse response of,59,1950,2008
the increased role of,59,1950,2008
the indian government 's,59,1950,2008
the industrial sector is,59,1950,2008
the influence of television,59,1950,2008
the information into a,59,1950,2008
the initial value problem,59,1950,2008
the international centre for,59,1950,2008
the international sociological association,59,1950,2008
the interpreter 's bible,59,1950,2008
the issue of power,59,1950,2008
the issues surrounding the,59,1950,2008
the japan society for,59,1950,2008
the john hopkins university,59,1950,2008
the joint probability distribution,59,1950,2008
the kmt and the,59,1950,2008
the korean peninsula and,59,1950,2008
the korean war broke,59,1950,2008
the lack of trust,59,1950,2008
the lateral decubitus position,59,1950,2008
the lateral geniculate nucleus,59,1950,2008
the latin american region,59,1950,2008
the life chances of,59,1950,2008
the lower bound of,59,1950,2008
the magazine of fantasy,59,1950,2008
the main limitation of,59,1950,2008
the mainstream of life,59,1950,2008
the major ethnic groups,59,1950,2008
the man she 'd,59,1950,2008
the marginal tax rate,59,1950,2008
the mass media for,59,1950,2008
the mass media in,59,1950,2008
the mass media is,59,1950,2008
the maximum likelihood estimator,59,1950,2008
the member states have,59,1950,2008
the membrane potential is,59,1950,2008
the middle east crisis,59,1950,2008
the military coup of,59,1950,2008
the ministry of natural,59,1950,2008
the model based on,59,1950,2008
the model proposed by,59,1950,2008
the money price of,59,1950,2008
the most important parameter,59,1950,2008
the most likely outcome,59,1950,2008
the most recent version,59,1950,2008
the museum is open,59,1950,2008
the myriad ways in,59,1950,2008
the need for surgery,59,1950,2008
the need to engage,59,1950,2008
the needs and concerns,59,1950,2008
the netherlands organization for,59,1950,2008
the new information and,59,1950,2008
the new jersey turnpike,59,1950,2008
the new people 's,59,1950,2008
the newly independent countries,59,1950,2008
the next section i,59,1950,2008
the ninth circuit held,59,1950,2008
the novel 's title,59,1950,2008
the nuclear power industry,59,1950,2008
the option of not,59,1950,2008
the other nordic countries,59,1950,2008
the overall condition of,59,1950,2008
the overall framework of,59,1950,2008
the overall goal of,59,1950,2008
the overall population of,59,1950,2008
the pace of reform,59,1950,2008
the pattern of investment,59,1950,2008
the penguin book of,59,1950,2008
the people of taiwan,59,1950,2008
the peoples ' republic,59,1950,2008
the percent change in,59,1950,2008
the percentage of americans,59,1950,2008
the phenomenology of spirit,59,1950,2008
the phone off the,59,1950,2008
the photo on the,59,1950,2008
the pivotal role of,59,1950,2008
the plasma membranes of,59,1950,2008
the political ramifications of,59,1950,2008
the potential for this,59,1950,2008
the presence of dna,59,1950,2008
the private sector as,59,1950,2008
the private sector which,59,1950,2008
the private sector would,59,1950,2008
the probability of acceptance,59,1950,2008
the problem solving process,59,1950,2008
the process of implementation,59,1950,2008
the process of managing,59,1950,2008
the process of structural,59,1950,2008
the profits of stock,59,1950,2008
the protection of civilian,59,1950,2008
the quality of communication,59,1950,2008
the quality of decisions,59,1950,2008
the radio and tv,59,1950,2008
the rationale behind this,59,1950,2008
the replication of the,59,1950,2008
the required reserve ratio,59,1950,2008
the rest frame of,59,1950,2008
the resting membrane potential,59,1950,2008
the review of economics,59,1950,2008
the risk of cancer,59,1950,2008
the role of civil,59,1950,2008
the role of institutions,59,1950,2008
the role of teachers,59,1950,2008
the rural poor in,59,1950,2008
the same parameters as,59,1950,2008
the sample size for,59,1950,2008
the san francisco peace,59,1950,2008
the shah and his,59,1950,2008
the skills you have,59,1950,2008
the social world as,59,1950,2008
the sociology of georg,59,1950,2008
the south african economy,59,1950,2008
the south west africa,59,1950,2008
the south west african,59,1950,2008
the southeast asia treaty,59,1950,2008
the space of all,59,1950,2008
the spatial variation of,59,1950,2008
the specifics of a,59,1950,2008
the spectral density of,59,1950,2008
the speed of convergence,59,1950,2008
the state government or,59,1950,2008
the state governments in,59,1950,2008
the state of punjab,59,1950,2008
the study area and,59,1950,2008
the suppression of communism,59,1950,2008
the table a copy,52,1950,2001
the tax consequences to,59,1950,2008
the teacher of righteousness,59,1950,2008
the territorial sea and,59,1950,2008
the territorial sea of,59,1950,2008
the third plenum of,59,1950,2008
the tour de france,59,1950,2008
the transport properties of,59,1950,2008
the treatment of breast,59,1950,2008
the treaty of rome,59,1950,2008
the two models is,59,1950,2008
the two treatment groups,59,1950,2008
the type i error,59,1950,2008
the ultimate example of,59,1950,2008
the united nations population,59,1950,2008
the university of east,59,1950,2008
the users in the,59,1950,2008
the ussr ministry of,59,1950,2008
the ussr supreme soviet,59,1950,2008
the valence band and,59,1950,2008
the valence band to,59,1950,2008
the viewer in the,59,1950,2008
the violation of human,59,1950,2008
the weeks leading up,59,1950,2008
the witch and the,59,1950,2008
the world 's poorest,59,1950,2008
the world socialist system,59,1950,2008
their ability to bind,59,1950,2008
their children 's school,59,1950,2008
their interactions with other,59,1950,2008
then it was back,59,1950,2008
theoretical model of the,59,1950,2008
theories of learning and,59,1950,2008
theories of the firm,59,1950,2008
therapist and the client,59,1950,2008
there are clear differences,59,1950,2008
there have been problems,59,1950,2008
there is currently no,59,1950,2008
there may be problems,59,1950,2008
there was concern about,59,1950,2008
these kinds of things,59,1950,2008
things i need to,59,1950,2008
think about how they,59,1950,2008
thinking about what it,59,1950,2008
third plenum of the,59,1950,2008
this approach assumes that,59,1950,2008
this article originally appeared,59,1950,2008
this can be particularly,59,1950,2008
this chapter will explore,59,1950,2008
this in the context,59,1950,2008
this paper we consider,59,1950,2008
this section presents a,59,1950,2008
this section we describe,59,1950,2008
this section we examine,59,1950,2008
this section we give,59,1950,2008
this show on the,59,1950,2008
this strategy is to,59,1950,2008
this technique is based,59,1950,2008
through her at the,59,1950,2008
through the territorial sea,59,1950,2008
time with your family,59,1950,2008
to a family member,59,1950,2008
to accept that he,59,1950,2008
to account for how,59,1950,2008
to account for why,59,1950,2008
to address all the,59,1950,2008
to adopt a ',59,1950,2008
to advance our understanding,59,1950,2008
to appear on television,59,1950,2008
to assess the risk,59,1950,2008
to be implemented as,59,1950,2008
to be implemented on,59,1950,2008
to be in breach,59,1950,2008
to be just fine,59,1950,2008
to become more involved,59,1950,2008
to change her life,59,1950,2008
to change your life,59,1950,2008
to choose not to,59,1950,2008
to cope with change,59,1950,2008
to create a viable,59,1950,2008
to create an alternative,59,1950,2008
to determine the next,59,1950,2008
to enhance the role,59,1950,2008
to ensure that information,59,1950,2008
to evaluate whether the,59,1950,2008
to explore how the,59,1950,2008
to extrapolate from the,59,1950,2008
to focus on some,59,1950,2008
to fully comprehend the,59,1950,2008
to half of all,59,1950,2008
to help students become,59,1950,2008
to help them deal,59,1950,2008
to identify and correct,59,1950,2008
to identify areas of,59,1950,2008
to identify the areas,59,1950,2008
to improve productivity and,59,1950,2008
to increase over time,59,1950,2008
to make better decisions,59,1950,2008
to mind when you,59,1950,2008
to mom and dad,59,1950,2008
to opt for the,59,1950,2008
to other group members,59,1950,2008
to participate in decision,59,1950,2008
to portray himself as,59,1950,2008
to print out the,59,1950,2008
to probability theory and,59,1950,2008
to reflect on your,59,1950,2008
to remedy the problem,59,1950,2008
to resolve these problems,59,1950,2008
to respond to specific,59,1950,2008
to scheduled castes and,59,1950,2008
to step down as,59,1950,2008
to testify about the,59,1950,2008
to the academic community,59,1950,2008
to the airport for,59,1950,2008
to the arms race,59,1950,2008
to the city center,59,1950,2008
to the family members,59,1950,2008
to the outcomes of,59,1950,2008
to the simulation of,59,1950,2008
to the valence band,59,1950,2008
to the viewer 's,59,1950,2008
to this edition and,59,1950,2008
to two orders of,59,1950,2008
to understand the potential,59,1950,2008
to view themselves as,59,1950,2008
tokyo institute of technology,59,1950,2008
top of the valence,59,1950,2008
total commitment to the,59,1950,2008
total number of nodes,59,1950,2008
transfer function can be,59,1950,2008
tried to talk me,59,1950,2008
trust for historic preservation,59,1950,2008
trying to determine if,59,1950,2008
turn up the volume,59,1950,2008
un high commissioner for,59,1950,2008
under government 's consideration,51,1950,2000
under the hypothesis that,59,1950,2008
under the light microscope,59,1950,2008
understand the world around,59,1950,2008
understanding of the key,59,1950,2008
understanding of the molecular,59,1950,2008
understood in this context,59,1950,2008
united nations children ',59,1950,2008
universidad de los andes,59,1950,2008
university of agriculture and,59,1950,2008
university of hawaii press,59,1950,2008
university of indiana press,59,1950,2008
university of massachusetts amherst,59,1950,2008
up with a way,59,1950,2008
urinary tract infection and,59,1950,2008
us to focus on,59,1950,2008
us to pay attention,59,1950,2008
used as the dependent,59,1950,2008
used to design a,59,1950,2008
used to generate an,59,1950,2008
useful when you want,59,1950,2008
using one of two,59,1950,2008
uttar pradesh and bihar,59,1950,2008
values in the data,59,1950,2008
values of the random,59,1950,2008
variable on the left,59,1950,2008
variables associated with the,59,1950,2008
variables used in this,59,1950,2008
variance accounted for by,59,1950,2008
version of the language,59,1950,2008
very little impact on,59,1950,2008
walk away from a,59,1950,2008
walk in the door,59,1950,2008
walked to his car,59,1950,2008
want to change and,59,1950,2008
want to focus on,59,1950,2008
want to search for,59,1950,2008
was a precondition for,59,1950,2008
was associated with higher,59,1950,2008
was in a foul,59,1950,2008
was in her mid,59,1950,2008
was like i was,59,1950,2008
was to focus on,59,1950,2008
was to identify and,59,1950,2008
was triggered by a,59,1950,2008
watched in awe as,59,1950,2008
way analysis of variance,59,1950,2008
way to address the,59,1950,2008
way to make sense,59,1950,2008
wayne state university press,59,1950,2008
ways of being and,59,1950,2008
we 'll talk more,59,1950,2008
we have identified a,59,1950,2008
we made it to,59,1950,2008
we need to become,59,1950,2008
we need to compute,59,1950,2008
we need to evaluate,59,1950,2008
we need to identify,59,1950,2008
we need to move,59,1950,2008
we tend not to,59,1950,2008
we will also discuss,59,1950,2008
we will be discussing,59,1950,2008
we will discuss each,59,1950,2008
we will examine how,59,1950,2008
weapons and foreign policy,59,1950,2008
went on to have,59,1950,2008
were not perceived as,59,1950,2008
west germany and france,59,1950,2008
west germany and japan,59,1950,2008
west germany in the,59,1950,2008
what 's my line,59,1950,2008
what steps government propose,43,1950,1992
what this suggests is,59,1950,2008
when asked about their,59,1950,2008
when you 're the,59,1950,2008
where the private sector,59,1950,2008
whether government are aware,51,1950,2000
which is why she,59,1950,2008
which the private sector,59,1950,2008
who had converted to,59,1950,2008
who identify themselves as,59,1950,2008
who we really are,59,1950,2008
who were identified as,59,1950,2008
why would they do,59,1950,2008
will discuss each of,59,1950,2008
will take a while,59,1950,2008
witch and the wardrobe,59,1950,2008
with a brief look,59,1950,2008
with a dollop of,59,1950,2008
with a focus on,59,1950,2008
with a larger than,59,1950,2008
with a partner to,59,1950,2008
with a thousand faces,59,1950,2008
with all deliberate speed,59,1950,2008
with cleft lip and,59,1950,2008
with intact ventricular septum,59,1950,2008
with strong support from,59,1950,2008
with suppliers and customers,59,1950,2008
with the common market,59,1950,2008
with the potential for,59,1950,2008
with the requirement to,59,1950,2008
with the state governments,59,1950,2008
with the tension between,59,1950,2008
with the therapist 's,59,1950,2008
within a system that,59,1950,2008
within the extended family,59,1950,2008
within the study area,59,1950,2008
within the study of,59,1950,2008
within the wider context,59,1950,2008
without whom this book,59,1950,2008
women and men have,59,1950,2008
women are involved in,59,1950,2008
women may be more,59,1950,2008
work in concert with,59,1950,2008
work on the topic,59,1950,2008
work out their differences,59,1950,2008
works and correspondence of,59,1950,2008
world congress of sociology,59,1950,2008
would like to focus,59,1950,2008
would request the hon,57,1950,2006
written answers to questions,47,1950,1996
wrote in my journal,59,1950,2008
year survival rate is,59,1950,2008
year survival rate was,59,1950,2008
york city transit authority,59,1950,2008
you 'll also be,59,1950,2008
you 'll probably need,59,1950,2008
you 're like most,59,1950,2008
you 're starting to,59,1950,2008
you a hard time,59,1950,2008
you are unsure of,59,1950,2008
you can explore the,59,1950,2008
you create your own,59,1950,2008
you feel good about,59,1950,2008
you for your concern,59,1950,2008
you have any problems,59,1950,2008
you make the decision,59,1950,2008
you need to set,59,1950,2008
you need to talk,59,1950,2008
you want to back,59,1950,2008
you want to control,59,1950,2008
you want to end,59,1950,2008
your goal should be,59,1950,2008
your social security number,59,1950,2008
zealand penguin books ltd,59,1950,2008
zero mean and variance,59,1950,2008
