,res,start,end
amis de la science,151,1800,1950
an de grâce mil,140,1811,1950
au bois de vincennes,151,1800,1950
au bonheur de ses,151,1800,1950
au commencement du mois,151,1800,1950
au duc d' anjou,137,1814,1950
au prince d' orange,151,1800,1950
au roi de navarre,151,1800,1950
au roi de suède,151,1800,1950
avec le nitrate d',151,1800,1950
bien petit nombre de,151,1800,1950
branches de la maison,151,1800,1950
bâton de maréchal de,151,1800,1950
ce que de raison,151,1800,1950
chambre des députés en,121,1830,1950
chaque corps d' armée,143,1808,1950
chemins de fer économiques,90,1861,1950
comme des bêtes fauves,151,1800,1950
confiance de la nation,151,1800,1950
cours de l' europe,151,1800,1950
dans ce peu de,151,1800,1950
dans ces derniers temps,151,1800,1950
dans de semblables circonstances,151,1800,1950
dans le décubitus dorsal,113,1838,1950
dans un autre état,112,1839,1950
dans une dépêche du,118,1833,1950
de fixer notre attention,151,1800,1950
de l' ambition des,151,1800,1950
de l' artillerie ennemie,137,1814,1950
de l' envie et,151,1800,1950
de la même opinion,151,1800,1950
de la propre main,151,1800,1950
de la science allemande,110,1841,1950
de la société asiatique,135,1816,1950
de notre sainte religion,151,1800,1950
de sa propre conservation,151,1800,1950
de tant de travaux,151,1800,1950
depuis son origine jusqu'à,151,1800,1950
des cris de mort,140,1811,1950
des finances sont chargés,151,1800,1950
des lettres de cachet,151,1800,1950
des lettres de gage,109,1842,1950
des mines de saint,125,1826,1950
deux bouts de l',141,1810,1950
dont il est revêtu,151,1800,1950
du duc de montpensier,133,1818,1950
du globe de l',151,1800,1950
du mérite et de,151,1800,1950
eau et d' acide,151,1800,1950
en bois de sapin,151,1800,1950
en fait de religion,151,1800,1950
en versant des larmes,151,1800,1950
enseignement secondaire des jeunes,73,1878,1950
entre les deux cours,151,1800,1950
entrer en négociation avec,151,1800,1950
est absolument le même,151,1800,1950
est donné lecture de,125,1826,1950
et il résolut de,151,1800,1950
et les bourgeois de,137,1814,1950
eu le droit d',151,1800,1950
extrémité inférieure du radius,126,1825,1950
formes prescrites par l',151,1800,1950
fécule de pommes de,146,1805,1950
grâce de la vie,151,1800,1950
il est donné lecture,127,1824,1950
innocence et de la,151,1800,1950
jusques à la fin,151,1800,1950
l ' action nationale,18,1933,1950
l ' effusion du,151,1800,1950
l' archevêque de toulouse,142,1809,1950
l' eau de baryte,151,1800,1950
l' empire d' autriche,135,1816,1950
l' enseignement secondaire des,86,1865,1950
l' innocence et de,151,1800,1950
l' intérieur de paris,134,1817,1950
l' état d' acide,151,1800,1950
la brigade de cavalerie,147,1804,1950
la charge de grand,151,1800,1950
la dignité de maréchal,132,1819,1950
la fin au prochain,122,1829,1950
la nomination du roi,151,1800,1950
la plus part des,151,1800,1950
la pyrite de fer,114,1837,1950
la quotité de l',151,1800,1950
la reine de navarre,150,1801,1950
la salle du festin,151,1800,1950
le cabinet de berlin,137,1814,1950
le cabinet de vienne,151,1800,1950
le cas dont il,151,1800,1950
le conseil communal de,117,1834,1950
le conservateur des hypothèques,135,1816,1950
le duc de penthièvre,151,1800,1950
le plus d' honneur,151,1800,1950
le prince de schwarzenberg,98,1853,1950
le sol de notre,127,1824,1950
les combinaisons de l',151,1800,1950
les droits de leur,79,1872,1950
les fois que ces,151,1800,1950
les hautes régions de,151,1800,1950
les ingénieurs des mines,134,1817,1950
les maires et adjoints,151,1800,1950
les sept heures du,151,1800,1950
lettre du comte de,151,1800,1950
loi de germinal an,130,1821,1950
lorsqu'il y aura lieu,151,1800,1950
maréchal de camp en,123,1828,1950
meilleur parti à prendre,151,1800,1950
membres de cette chambre,139,1812,1950
mention de l ',151,1800,1950
ministre des finances sont,80,1871,1950
montant sur le trône,151,1800,1950
moyen de l' eau,151,1800,1950
médaille d' or pour,136,1815,1950
même à la cour,151,1800,1950
n'est pas même nécessaire,151,1800,1950
nationale d' horticulture de,72,1879,1950
nationale supérieure des mines,68,1883,1950
ne larda pas à,151,1800,1950
ne m'arrêterai pas à,151,1800,1950
nul ne pourra être,151,1800,1950
on se convaincra que,151,1800,1950
ont cela de commun,151,1800,1950
ordre de la noblesse,151,1800,1950
par ce moyen il,151,1800,1950
par cela même qu'elles,151,1800,1950
par l' acide azotique,116,1835,1950
par la voix publique,151,1800,1950
par le présent acte,145,1806,1950
par tout le royaume,151,1800,1950
pas un seul jour,151,1800,1950
physiques et naturelles de,110,1841,1950
plus saint des devoirs,151,1800,1950
plénipotentiaire de sa majesté,129,1822,1950
pour un capital de,115,1836,1950
prit possession de la,148,1803,1950
prix de la valeur,151,1800,1950
prix que ce fût,151,1800,1950
publics est chargé de,120,1831,1950
publique et de salubrité,105,1846,1950
quand même il serait,151,1800,1950
quantité de sang qui,151,1800,1950
que ce soit chose,146,1805,1950
que l' autriche ne,138,1813,1950
que l' empereur d',143,1808,1950
que l' on lui,151,1800,1950
que vous devez à,151,1800,1950
qui ne voudront pas,151,1800,1950
roy de france et,135,1816,1950
signées de notre main,151,1800,1950
société d' horticulture de,128,1823,1950
son lit de douleur,142,1809,1950
sous le litre de,151,1800,1950
sur ce sujet les,151,1800,1950
sur le livre des,151,1800,1950
tarda pas à reconnaître,144,1807,1950
titre de membre correspondant,128,1823,1950
tout ce que dessus,150,1801,1950
une cloche de verre,151,1800,1950
une des dernières séances,151,1800,1950
une grêle de pierres,151,1800,1950
une lame de cuivre,151,1800,1950
une médaille d' argent,151,1800,1950
à l' empereur alexandre,145,1806,1950
à l' orient de,151,1800,1950
à la bibliothèque impériale,102,1849,1950
à sa majesté impériale,149,1802,1950
à une heure après,151,1800,1950
à votre majesté de,145,1806,1950
écus d ' or,151,1800,1950
