,res,start,end
aber nicht um eine,159,1850,2008
aber selbst wenn die,159,1850,2008
abweichungen von der norm,159,1850,2008
alle schichten der bevölkerung,159,1850,2008
als ausgangspunkt für die,159,1850,2008
als conditio sine qua,159,1850,2008
als die meisten anderen,159,1850,2008
am anderen ende des,159,1850,2008
an anderen stellen der,159,1850,2008
an der akademie der,159,1850,2008
an der richtigen stelle,159,1850,2008
an dieser stelle auch,159,1850,2008
an dieser stelle noch,159,1850,2008
auch auf grund der,159,1850,2008
auch aus anderen gründen,159,1850,2008
auch die gefahr der,159,1850,2008
auch eine anzahl von,159,1850,2008
auch in der musik,159,1850,2008
auch in der wissenschaftlichen,159,1850,2008
auf dem weg nach,159,1850,2008
auf die beschreibung der,159,1850,2008
aus denen sich das,159,1850,2008
aus der entwicklung der,159,1850,2008
be returned on or,151,1850,2000
before the date last,151,1850,2000
bei der auswahl von,95,1850,1944
bei der bemessung der,159,1850,2008
bei der herstellung des,159,1850,2008
bezogen sich auf die,159,1850,2008
bis in unsere zeit,159,1850,2008
bis zum eintritt in,159,1850,2008
das ist an sich,159,1850,2008
das sich an der,159,1850,2008
das sich in einer,159,1850,2008
das war in der,159,1850,2008
dass es sich auch,141,1850,1990
dass es sich dabei,159,1850,2008
dass es sich um,159,1850,2008
date last stamped below,151,1850,2000
dem ende des zweiten,159,1850,2008
den garaus zu machen,159,1850,2008
den letzten jahren ein,159,1850,2008
den ursprung der sprache,159,1850,2008
den vereinigten staaten die,159,1850,2008
den vordergrund gestellt werden,159,1850,2008
der druck in der,159,1850,2008
der erhaltung der kraft,159,1850,2008
der fassung des gesetzes,159,1850,2008
der grenze zwischen den,95,1850,1944
der hauptsache auf die,159,1850,2008
der herr vorredner hat,88,1850,1937
der lage sein wird,159,1850,2008
der letzten jahre in,159,1850,2008
der letzten jahre und,159,1850,2008
der mitte des bildes,159,1850,2008
der sich selbst als,159,1850,2008
der staatlichen und gesellschaftlichen,159,1850,2008
der vertrag über die,159,1850,2008
der welt zu schaffen,159,1850,2008
deshalb in der regel,159,1850,2008
die angaben über den,159,1850,2008
die bevölkerung in der,159,1850,2008
die dauer des krieges,159,1850,2008
die den inhalt der,159,1850,2008
die den kern der,159,1850,2008
die einführung des allgemeinen,159,1850,2008
die frage beantwortet werden,159,1850,2008
die möglichkeit für die,159,1850,2008
die rede von den,159,1850,2008
die sich besonders in,159,1850,2008
die sich im besitz,159,1850,2008
die unter dem druck,159,1850,2008
dies gilt insbesondere auch,159,1850,2008
du droit des gens,155,1850,2004
ein ausdruck für die,159,1850,2008
ein beispiel für die,159,1850,2008
ein beitrag zur lehre,159,1850,2008
ein mittel zum zweck,159,1850,2008
eine bedeutung für die,159,1850,2008
eine frage nach der,159,1850,2008
eine neue form der,159,1850,2008
einem gewissen grade auch,159,1850,2008
einen tag vor der,159,1850,2008
enthält eine reihe von,159,1850,2008
er auf grund der,159,1850,2008
er den begriff der,159,1850,2008
er in den jahren,159,1850,2008
erfahrungen der letzten jahre,159,1850,2008
ergibt sich für den,159,1850,2008
erheblichen einfluss auf die,66,1850,1915
erwies sich als ein,159,1850,2008
erwies sich als eine,159,1850,2008
es in der deutschen,159,1850,2008
es ist deshalb nicht,159,1850,2008
es ist sehr wohl,159,1850,2008
es nicht zu einem,159,1850,2008
es sich bei ihr,159,1850,2008
es sich dabei um,159,1850,2008
es sich jedoch um,159,1850,2008
es sich wirklich um,159,1850,2008
etwas anderes als ein,159,1850,2008
frage nach der bedeutung,159,1850,2008
für das kommende jahr,159,1850,2008
für die bildende kunst,159,1850,2008
für die entfaltung der,159,1850,2008
für die erfüllung ihrer,159,1850,2008
für die herstellung und,159,1850,2008
für die verteidigung des,159,1850,2008
ganz anders als in,159,1850,2008
ganz im gegensatz zu,159,1850,2008
gar nicht so weit,159,1850,2008
geht es in der,159,1850,2008
gerade in der letzten,159,1850,2008
gibt es nur eine,159,1850,2008
gibt es nur wenige,159,1850,2008
haben im laufe der,159,1850,2008
handelt es sich doch,159,1850,2008
handle sich hier um,159,1850,2008
heute noch in den,159,1850,2008
ich zum ersten mal,159,1850,2008
ihre ursache in der,159,1850,2008
ihrer bedeutung für die,159,1850,2008
im gegensatz zu denen,159,1850,2008
im gegensatz zu diesem,159,1850,2008
im letzten viertel des,159,1850,2008
im vorliegenden fall nicht,159,1850,2008
im zusammenhang mit den,159,1850,2008
in beziehung gebracht werden,159,1850,2008
in dem man die,159,1850,2008
in dem sie den,159,1850,2008
in den bildenden künsten,159,1850,2008
in den europäischen staaten,159,1850,2008
in den sitzungsberichten der,159,1850,2008
in den vierziger jahren,159,1850,2008
in denen auch die,159,1850,2008
in der hauptsache aus,159,1850,2008
in der hauptsache durch,159,1850,2008
in der lage wären,159,1850,2008
in der praxis die,159,1850,2008
in der praxis nur,159,1850,2008
in der technik der,159,1850,2008
in der unmittelbaren nachbarschaft,159,1850,2008
in diesem fall auch,159,1850,2008
in diesem fall ein,159,1850,2008
in diesem falle also,159,1850,2008
in dieser form in,159,1850,2008
in dieser richtung sind,159,1850,2008
in dieser zeit wurde,159,1850,2008
in einem abstand von,159,1850,2008
in einer ganzen reihe,159,1850,2008
in gewisser weise die,159,1850,2008
in seinem aufsatz über,159,1850,2008
in wahrheit gar nicht,159,1850,2008
in ähnlicher weise ist,159,1850,2008
ins rechte licht zu,159,1850,2008
ist als bei der,159,1850,2008
ist bis zu einem,159,1850,2008
ist das auftreten von,159,1850,2008
ist ein akt der,159,1850,2008
ist ein produkt der,159,1850,2008
ist im grunde ein,159,1850,2008
ist immer noch nicht,159,1850,2008
ist in der zweiten,159,1850,2008
ist jedoch nur eine,159,1850,2008
ist und in dem,159,1850,2008
jahre nach dem erscheinen,159,1850,2008
kommen wir zu der,159,1850,2008
kommt es für die,159,1850,2008
laufe der nächsten jahre,159,1850,2008
lebens auf der erde,159,1850,2008
library university of california,154,1850,2003
man auf grund der,159,1850,2008
man in der lage,159,1850,2008
mehr als alles andere,159,1850,2008
mehr als die anderen,159,1850,2008
mich an dieser stelle,159,1850,2008
mit dem verhalten der,159,1850,2008
mit den mitteln des,159,1850,2008
mit denen der anderen,159,1850,2008
mit einem kostenaufwand von,159,1850,2008
mit einer fülle von,159,1850,2008
nach dem system der,159,1850,2008
nach dem ursprung der,159,1850,2008
nach der ausgabe von,159,1850,2008
nicht aus der welt,159,1850,2008
nicht mehr gesprochen werden,159,1850,2008
nicht mehr so stark,159,1850,2008
nicht oder nicht rechtzeitig,159,1850,2008
nicht zu erreichen war,159,1850,2008
noch darauf hingewiesen werden,159,1850,2008
nur unter bestimmten voraussetzungen,159,1850,2008
or before the date,151,1850,2000
rechts und links der,159,1850,2008
returned on or before,151,1850,2000
seinem bericht über die,159,1850,2008
seit jahren nicht mehr,159,1850,2008
should be returned on,151,1850,2000
sich auch hier um,159,1850,2008
sich dabei um die,159,1850,2008
sich im wesentlichen auf,159,1850,2008
sich in einem anderen,159,1850,2008
sie ebenso wie die,159,1850,2008
sind und die sich,159,1850,2008
sine qua non für,159,1850,2008
so gut wie nicht,159,1850,2008
sollte es möglich sein,159,1850,2008
sondern auch zwischen den,159,1850,2008
soweit es sich nicht,159,1850,2008
sowohl in deutschland als,159,1850,2008
stellt sich auch die,159,1850,2008
tage nach beginn der,159,1850,2008
the date last stamped,151,1850,2000
this book should be,151,1850,2000
um die einheit der,159,1850,2008
um die entwicklung der,159,1850,2008
um mehr als um,159,1850,2008
und das ist ja,159,1850,2008
und der vereinigten staaten,159,1850,2008
und die einrichtung von,159,1850,2008
und die erhöhung des,159,1850,2008
und die welt der,159,1850,2008
und eine ganze reihe,159,1850,2008
und einer reihe von,159,1850,2008
und gerade für die,159,1850,2008
und ihre wirkung auf,159,1850,2008
und zwar sowohl der,159,1850,2008
untereinander und mit dem,159,1850,2008
unterscheiden sich in der,159,1850,2008
untersuchungen über die wirkung,158,1850,2007
von der aufgabe der,159,1850,2008
von der vorstellung des,159,1850,2008
von handel und industrie,159,1850,2008
vor ausbruch des krieges,159,1850,2008
vorwort zur ersten auflage,159,1850,2008
war schon die rede,159,1850,2008
werke der bildenden kunst,159,1850,2008
wie die meisten anderen,159,1850,2008
wie in den früheren,159,1850,2008
wie in den vereinigten,159,1850,2008
wird in der praxis,159,1850,2008
wobei er sich auf,159,1850,2008
wurden im laufe des,159,1850,2008
während des krieges in,159,1850,2008
zeichnen sich dadurch aus,159,1850,2008
zeigt sich in einer,159,1850,2008
zu anfang des jahrhunderts,159,1850,2008
zu einem nicht geringen,159,1850,2008
zu einer erhöhung der,159,1850,2008
zu entwickeln und die,159,1850,2008
zum beispiel bei der,159,1850,2008
zum ersten mal von,159,1850,2008
zur verfügung gestellt worden,159,1850,2008
über die welt und,159,1850,2008
